,author,created_utc,permalink,selftext,subreddit,title,url,created
6,lacroixalty,1533760002,/r/college/comments/95pppu/the_college_guide_for_poor_kids/,"hi r/college!

After browsing this thread for a while and also just searching online, I realized that while there’s an abundant amount of information and college survival tips/guides for the average college student, there’s hardly any for *actual* poor students and students of immigrants/first gen kids. After three frustrating years at Boston University, a seemingly progressive private institution that basically just discriminates against its lower income students, I decided to create my own guide as a lower income student who is a child of a single parent immigrant for anyone who might be facing the same experiences or about to enter college. Feel more than free to enter your own tips and/or experiences! 

1. Work Study: Most lower income students qualify for work study, and while its a good federal aid opportunity, I quickly realized after my freshman year that you don’t really get paid enough to live because there’s a cap on the amount of hours you can work, especially if your parents can’t afford to give you some spending money too. I recommend getting a second job if possible, and either working very little hours through work study, or forfeiting it altogether. 
2. Financial aid: You’d think schools would be more willing to help lower income students who are already enrolled but that’s just not the case. If you ever find yourself needing more money from the school, I highly recommend appealing for more (even if its a small amount). If they deny your appeal, keep calling the office. I have a friend who even emailed our financial aid office once and talked about his deteriorating mental health as a way to guilt trip them into giving more aid. 
3. Discrimination: The funny thing about my school (and probably all seemingly “progressive” institutions) is that they try to hide how discriminatory they are. This year, and every year for the past three years, I was “randomly” selected for income verification as were many of my other low income friends. Not very random if you’re only targeting low income students. Little things like this are the just some points of discrimination I and many others face every year at private institutions. 
4. Health Insurance: If like mine, your parents are immigrants and don’t qualify for health insurance, the odds are that your school will try to force you to pay for their student insurance plan. That would be fine, if said insurance plans didn’t cost thousands of dollars, which is kind of contradictory if you can’t afford health insurance, or tuition, to begin with. I didn’t realize until this year that there’s an easy loophole around this if you’re able to find a part or full time job that offers health insurance, which is helpful to begin with if you already plan on getting a job in addition or in lieu of work study. 
5. Housing: I lived in on campus housing for the first two years of college, and then decided to move off campus. Many other low income students I know fear doing the same because of student housing scholarships, which is fair, but what I’ve found is that living off campus is for the most part still cheaper than living on campus with a housing scholarship. If you also get federal aid, that money can also be refunded back to you to pay for the cost of rent. At the end of the day, paying around the same to live off campus and have your own room, kitchen, privacy etc will always be better than living on campus and sharing a room with someone in a dorm that hasn’t been renovated in 50 years. 
6. Friends/Socializing: This is one of the hardest things for me to deal with, because I’m constantly surrounded by middle class and to upper class kids who complain about how poor they are and how expensive school is. Yes, school totally is expensive. But I can’t pity someone who comes from a well off family when mine can barely afford rent let alone put me through school. (Seriously, I once had a girl complain to me about how her family makes 100K so she doesnt get any federal aid and so “in a lot of ways college is harder for middle class students than poor ones”). Its also hard when your friends parents pay for all their ubers and they can afford to go out almost every day and you can’t. My best advice is to not try to follow that lifestyle if/when you can’t. It sucks, but unless you want to work like a dog to be able to afford it, it really isn’t worth it. 
7. Parents: If you’re a first gen college student, especially if your parents arent from this country, there’s a weird phenomena that happens in college where you kind of feel caught between worlds. There’s the world of poverty you feel like you belong to, and then there’s the world of academia and security that you’re introduced to. In a way its alienating, because you can’t really even turn to your parents for guidance since they haven’t experienced it. You can’t ask your parents about motifs in *The Great Gatsby* if they’ve never read *The Great Gatsby*. This is actually still something I struggle with, but the longer I’ve been in school, the more I’ve been able to find people in a similar boat. We’re all sinking together. 
8. Major: This is similar to the above. There’s a huge pressure, once again especially if you’re the child of immigrants, to study something lucrative in college so you can make more money and rectify their choices/emigration. That’s perfect if you naturally excel and want to study engineering, but it can lead to so much anxiety if you want to study something related to the arts or humanities. My best advice is to study what *you* like and what makes you happy even if your parents don’t approve, because at the end of the day its your life. Additionally, it can still be difficult to pursue the arts in school because, at least in my experience, most kids who do study something in the arts are the ones who can afford to, meaning they have their parents to fall back on and pay their rent even if they dont excel after college. Or, their parents have the ability to help them out after school with industry connections. 
9. Student Organizations: One thing I’ve found after joining a fraternity is that dues are super high and you can’t always afford them even if you’re working. This is even harder if you can’t ask your parents for financial help, so apply for all the inter-organization scholarships you can, or try to talk to the leader of whatever organization you’re apart of about lowering your dues.
10. Textbooks: Split the cost with a friend! Check the university library because they often have a copy of whatever book you need! Then photocopy the book or ask to borrow a copy from your classmate and then photocopy theirs! Yeah its time consuming, but textbooks are super expensive and this is a virtually free way to get them. I haven’t had to encounter any online textbooks that *require*  you to buy them, but I would also talk to the professor of whatever course you’re taking and explain the situation. They’re a lot more understanding than the university as a whole.
11. Food: Ask your friends who have meal plans to swipe you in! Buy in bulk! Trader Joe’s is cheap and incredible! I also recommend buying groceries every two or three days instead of weekly to avoid waste of food and money. 
12. Mental Health: Even today its still kinda taboo to discuss mental health, and i felt weird mentioning that i go to therapy until this year when i realized a lot of my other friends do too. don’t hesitate to go, even though i know how hard it is to take the first step. More often than not, whatever insurance you’re on covers most or all of your outpatient costs, and if its still too expensive, most universities offer on campus licensed mental health professionals at little to no cost. One of the perks of being in a high stress environment. 

That’s all for now but I will definitely update if i think of anything else. Apologies if any of this comes off as bitter or spiteful towards anyone who isn’t from a low income/international fam, I love everyone regardless but it can definitely be isolating to only see middle class and upper class experiences discussed in both this thread and around you at school. Feel free to add below !! ",college,The College Guide for Poor Kids,https://www.reddit.com/r/college/comments/95pppu/the_college_guide_for_poor_kids/,1533778002.0
